{
  "name": "h3c-switching-stack-to-cisco",
  "source_domain": "switching",
  "source_vendor": "h3c",
  "source_platform": "comware",
  "target_domain": "switching",
  "target_vendor": "cisco",
  "target_platform": "ios",
  "features": [
    "stack"
  ],
  "risk": "medium",
  "source_config": "#\nirf-port 1/1\n port group interface GigabitEthernet1/0/1\n port group interface GigabitEthernet1/0/2\n#\nirf-port 2/2\n port group interface GigabitEthernet2/0/1\n port group interface GigabitEthernet2/0/2\n#\nirf mac-address persistent always\nirf auto-update enable\n#",
  "expected": {
    "deployable": false,
    "manual_review_required": true,
    "no_markdown_fence": true,
    "no_placeholder": true,
    "must_include": [
      "MANUAL_REVIEW",
      "stack"
    ],
    "must_not_include": [
      "<irf",
      "TODO",
      "PLACEHOLDER"
    ],
    "max_level": "warning"
  }
}